Original Index,Title,Location,Organisation Chain,Bid Opening Place,Work Description,Tender Value in ₹,Product Category,Sub category,Pincode,Tender Reference Number,Tender ID,Tender Type,Tender Category,EMD Payable To,EMD Payable At,Awarded Value,Contract Date :,Contract Value :,Unnamed: 18
5871,Installation and energisation of Bakadaguda I L.I.Project under Dasmantpur Block of Koraput District,Bhanjanagar,"CE-BM,RVN Basin,Berhampur||S.E. Southern Irr. Circle I Berhampur||EE Bhanjanagar Irrigation Divn Bhanjanagar","O/o C.E.-B.M, RBVN Basin, Berhampur",Installation and energisation of Bakadaguda I L.I.Project under Dasmantpur Block of Koraput District,"8,91,000",Civil Works - Others,,761126,e-BNID-05/2022-23,2022_CEBMB_79197_4,Open Tender,Works,Nil,Nil,"856,867",28-Dec-2022,"INR 856,867",
5872,Installation and energisation of Bagiribeda II L.I.Project under Dasmantpur Block of Koraput District,Bhanjanagar,"CE-BM,RVN Basin,Berhampur||S.E. Southern Irr. Circle I Berhampur||EE Bhanjanagar Irrigation Divn Bhanjanagar","O/o C.E.-B.M, RBVN Basin, Berhampur",Installation and energisation of Bagiribeda II L.I.Project under Dasmantpur Block of Koraput District,"8,93,000",Civil Works - Others,,761126,e-BNID-05/2022-23,2022_CEBMB_79197_3,Open Tender,Works,Nil,Nil,"858,459",27-Dec-2022,"INR 858,459",
5873,Installation and energisation of Bagiribeda I L.I.Project under Dasmantpur Block of Koraput District,Bhanjanagar,"CE-BM,RVN Basin,Berhampur||S.E. Southern Irr. Circle I Berhampur||EE Bhanjanagar Irrigation Divn Bhanjanagar","O/o C.E.-B.M, RBVN Basin, Berhampur",Installation and energisation of Bagiribeda I L.I.Project under Dasmantpur Block of Koraput District,"7,00,000",Civil Works - Others,,761126,e-BNID-05/2022-23,2022_CEBMB_79197_26,Open Tender,Works,Nil,Nil,"606,940",30-Dec-2022,"INR 606,940",
5874,Installation and energisation of Badalimaliguda III L.I.Project under Dasmantpur Block of Koraput District,Bhanjanagar,"CE-BM,RVN Basin,Berhampur||S.E. Southern Irr. Circle I Berhampur||EE Bhanjanagar Irrigation Divn Bhanjanagar","O/o C.E.-B.M, RBVN Basin, Berhampur",Installation and energisation of Badalimaliguda III L.I.Project under Dasmantpur Block of Koraput District,"6,48,000",Civil Works - Others,,761126,e-BNID-05/2022-23,2022_CEBMB_79197_25,Open Tender,Works,Nil,Nil,"563,140",30-Dec-2022,"INR 563,140",
5875,Installation and energisation of Badalimaliguda I II L.I.Project under Dasmantpur Block of Koraput District,Bhanjanagar,"CE-BM,RVN Basin,Berhampur||S.E. Southern Irr. Circle I Berhampur||EE Bhanjanagar Irrigation Divn Bhanjanagar","O/o C.E.-B.M, RBVN Basin, Berhampur",Installation and energisation of Badalimaliguda I II L.I.Project under Dasmantpur Block of Koraput District,"5,30,000",Civil Works - Others,,761126,e-BNID-05/2022-23,2022_CEBMB_79197_24,Open Tender,Works,Nil,Nil,"480,482",30-Dec-2022,"INR 480,482",
5876,Installation and energisation of Badaguda L.I.Project under Dasmantpur Block of Koraput District,Bhanjanagar,"CE-BM,RVN Basin,Berhampur||S.E. Southern Irr. Circle I Berhampur||EE Bhanjanagar Irrigation Divn Bhanjanagar","O/o C.E.-B.M, RBVN Basin, Berhampur",Installation and energisation of Badaguda L.I.Project under Dasmantpur Block of Koraput District,"5,24,000",Civil Works - Others,,761126,e-BNID-05/2022-23,2022_CEBMB_79197_23,Open Tender,Works,Nil,Nil,"475,708",30-Dec-2022,"INR 475,708",
5877,Installation and energisation of Admanda L.I.Project under Dasmantpur Block of Koraput District,Bhanjanagar,"CE-BM,RVN Basin,Berhampur||S.E. Southern Irr. Circle I Berhampur||EE Bhanjanagar Irrigation Divn Bhanjanagar","O/o C.E.-B.M, RBVN Basin, Berhampur",Installation and energisation of Admanda L.I.Project under Dasmantpur Block of Koraput District,"4,95,000",Civil Works - Others,,761126,e-BNID-05/2022-23,2022_CEBMB_79197_22,Open Tender,Works,Nil,Nil,"431,259",30-Dec-2022,"INR 431,259",
5878,Installation and energisation of Tokiguda V L.I.Project under Boriguma Block of Koraput District,Bhanjanagar,"CE-BM,RVN Basin,Berhampur||S.E. Southern Irr. Circle I Berhampur||EE Bhanjanagar Irrigation Divn Bhanjanagar","O/o C.E.-B.M, RBVN Basin, Berhampur",Installation and energisation of Tokiguda V L.I.Project under Boriguma Block of Koraput District,"11,61,000",Civil Works - Others,,761126,e-BNID-05/2022-23,2022_CEBMB_79197_21,Open Tender,Works,Nil,Nil,"989,250",29-Dec-2022,"INR 989,250",
5879,Installation and energisation of Kuspriaguda L.I.Project under Baipariguda Block of Koraput District,Bhanjanagar,"CE-BM,RVN Basin,Berhampur||S.E. Southern Irr. Circle I Berhampur||EE Bhanjanagar Irrigation Divn Bhanjanagar","O/o C.E.-B.M, RBVN Basin, Berhampur",Installation and energisation of Kuspriaguda L.I.Project under Baipariguda Block of Koraput District,"6,64,000",Civil Works - Others,,761126,e-BNID-05/2022-23,2022_CEBMB_79197_20,Open Tender,Works,Nil,Nil,"663,746",29-Dec-2022,"INR 663,746",
5880,Installation and energisation of Tokiguda IV L.I.Project under Boriguma Block of Koraput District,Bhanjanagar,"CE-BM,RVN Basin,Berhampur||S.E. Southern Irr. Circle I Berhampur||EE Bhanjanagar Irrigation Divn Bhanjanagar","O/o C.E.-B.M, RBVN Basin, Berhampur",Installation and energisation of Tokiguda IV L.I.Project under Boriguma Block of Koraput District,"8,89,000",Civil Works - Others,,761126,e-BNID-05/2022-23,2022_CEBMB_79197_2,Open Tender,Works,Nil,Nil,"855,276",27-Dec-2022,"INR 855,276",
5881,Installation and energisation of Sanataragia L.I.Project under Boriguma Block of Koraput District,Bhanjanagar,"CE-BM,RVN Basin,Berhampur||S.E. Southern Irr. Circle I Berhampur||EE Bhanjanagar Irrigation Divn Bhanjanagar","O/o C.E.-B.M, RBVN Basin, Berhampur",Installation and energisation of Sanataragia L.I.Project under Boriguma Block of Koraput District,"6,51,000",Civil Works - Others,,761126,e-BNID-05/2022-23,2022_CEBMB_79197_19,Open Tender,Works,Nil,Nil,"650,449",29-Dec-2022,"INR 650,449",
5882,Installation and energisation of Sanparia X L.I.Project under Boriguma Block of Koraput District,Bhanjanagar,"CE-BM,RVN Basin,Berhampur||S.E. Southern Irr. Circle I Berhampur||EE Bhanjanagar Irrigation Divn Bhanjanagar","O/o C.E.-B.M, RBVN Basin, Berhampur",Installation and energisation of Sanparia X L.I.Project under Boriguma Block of Koraput District,"6,45,000",Civil Works - Others,,761126,e-BNID-05/2022-23,2022_CEBMB_79197_18,Open Tender,Works,Nil,Nil,"644,903",29-Dec-2022,"INR 644,903",
5883,Installation and energisation of Sanparia VIII L.I.Project under Boriguma Block of Koraput District,Bhanjanagar,"CE-BM,RVN Basin,Berhampur||S.E. Southern Irr. Circle I Berhampur||EE Bhanjanagar Irrigation Divn Bhanjanagar","O/o C.E.-B.M, RBVN Basin, Berhampur",Installation and energisation of Sanparia VIII L.I.Project under Boriguma Block of Koraput District,"6,42,000",Civil Works - Others,,761126,e-BNID-05/2022-23,2022_CEBMB_79197_17,Open Tender,Works,Nil,Nil,"641,179",29-Dec-2022,"INR 641,179",
5884,Installation and energisation of Sanparia IX L.I.Project under Boriguma Block of Koraput District,Bhanjanagar,"CE-BM,RVN Basin,Berhampur||S.E. Southern Irr. Circle I Berhampur||EE Bhanjanagar Irrigation Divn Bhanjanagar","O/o C.E.-B.M, RBVN Basin, Berhampur",Installation and energisation of Sanparia IX L.I.Project under Boriguma Block of Koraput District,"6,84,000",Civil Works - Others,,761126,e-BNID-05/2022-23,2022_CEBMB_79197_16,Open Tender,Works,Nil,Nil,"683,259",29-Dec-2022,"INR 683,259",
5885,Installation and energisation of Retali XII L.I.Project under Boriguma Block of Koraput District,Bhanjanagar,"CE-BM,RVN Basin,Berhampur||S.E. Southern Irr. Circle I Berhampur||EE Bhanjanagar Irrigation Divn Bhanjanagar","O/o C.E.-B.M, RBVN Basin, Berhampur",Installation and energisation of Retali XII L.I.Project under Boriguma Block of Koraput District,"6,64,000",Civil Works - Others,,761126,e-BNID-05/2022-23,2022_CEBMB_79197_15,Open Tender,Works,Nil,Nil,"663,389",29-Dec-2022,"INR 663,389",
5886,Installation and energisation of Retali XI L.I.Project under Boriguma Block of Koraput District,Bhanjanagar,"CE-BM,RVN Basin,Berhampur||S.E. Southern Irr. Circle I Berhampur||EE Bhanjanagar Irrigation Divn Bhanjanagar","O/o C.E.-B.M, RBVN Basin, Berhampur",Installation and energisation of Retali XI L.I.Project under Boriguma Block of Koraput District,"6,24,000",Civil Works - Others,,761126,e-BNID-05/2022-23,2022_CEBMB_79197_14,Open Tender,Works,Nil,Nil,"623,595",29-Dec-2022,"INR 623,595",
5887,Installation and energisation of Pakhanaguda VIII L.I.Project under Boriguma Block of Koraput District,Bhanjanagar,"CE-BM,RVN Basin,Berhampur||S.E. Southern Irr. Circle I Berhampur||EE Bhanjanagar Irrigation Divn Bhanjanagar","O/o C.E.-B.M, RBVN Basin, Berhampur",Installation and energisation of Pakhanaguda VIII L.I.Project under Boriguma Block of Koraput District,"7,78,000",Civil Works - Others,,761126,e-BNID-05/2022-23,2022_CEBMB_79197_13,Open Tender,Works,Nil,Nil,"777,739",29-Dec-2022,"INR 777,739",
5888,Installation and energisation of Pakhanaguda VII L.I.Project under Boriguma Block of Koraput District,Bhanjanagar,"CE-BM,RVN Basin,Berhampur||S.E. Southern Irr. Circle I Berhampur||EE Bhanjanagar Irrigation Divn Bhanjanagar","O/o C.E.-B.M, RBVN Basin, Berhampur",Installation and energisation of Pakhanaguda VII L.I.Project under Boriguma Block of Koraput District,"7,75,000",Civil Works - Others,,761126,e-BNID-05/2022-23,2022_CEBMB_79197_12,Open Tender,Works,Nil,Nil,"774,416",29-Dec-2022,"INR 774,416",
5889,Installation and energisation of Narigam VII L.I.Project under Boriguma Block of Koraput District,Bhanjanagar,"CE-BM,RVN Basin,Berhampur||S.E. Southern Irr. Circle I Berhampur||EE Bhanjanagar Irrigation Divn Bhanjanagar","O/o C.E.-B.M, RBVN Basin, Berhampur",Installation and energisation of Narigam VII L.I.Project under Boriguma Block of Koraput District,"7,68,000",Civil Works - Others,,761126,e-BNID-05/2022-23,2022_CEBMB_79197_11,Open Tender,Works,Nil,Nil,"767,330",29-Dec-2022,"INR 767,330",
5890,Installation and energisation of Khaparaput L.I.Project under Baipariguda Block of Koraput District,Bhanjanagar,"CE-BM,RVN Basin,Berhampur||S.E. Southern Irr. Circle I Berhampur||EE Bhanjanagar Irrigation Divn Bhanjanagar","O/o C.E.-B.M, RBVN Basin, Berhampur",Installation and energisation of Khaparaput L.I.Project under Baipariguda Block of Koraput District,"5,32,000",Civil Works - Others,,761126,e-BNID-05/2022-23,2022_CEBMB_79197_1,Open Tender,Works,Nil,Nil,"481,985",27-Dec-2022,"INR 481,985",
5891,Installation and energisation of Narigam VI L.I.Project under Boriguma Block of Koraput District,Chhatrapur,"CE-BM,RVN Basin,Berhampur||S.E. Southern Irr. Circle I Berhampur","O/o the Additional CE, RB Basin, Berhampur",Installation and energisation of Narigam VI L.I.Project under Boriguma Block of Koraput District,"4,95,54,566",Civil Works - Others,,761020,"ACE,RBB-08/2022-23",2022_CEBMB_78817_2,National Competitive Bid,Works,Nil,Nil,"42,126,336.81",01-Jan-2023,"INR 42,126,337",
5892,Installation and energisation of Manahara V L.I.Project under Boriguma Block of Koraput District,Bhanjanagar,"CE-BM,RVN Basin,Berhampur||S.E. Southern Irr. Circle I Berhampur||EE Bhanjanagar Irrigation Divn Bhanjanagar","O/o C.E.-B.M, RBVN Basin, Berhampur",Installation and energisation of Manahara V L.I.Project under Boriguma Block of Koraput District,"14,12,000",Civil Works - Others,,761126,e-BNID-04/2022-23,2022_CEBMB_78504_9,Open Tender,Works,Nil,Nil,"1,199,548",26-Dec-2022,"INR 1,199,548",
5893,Installation and energisation of Manahara IV L.I.Project under Boriguma Block of Koraput Districtof Malinibhata L.I.Project under Boriguma Block of Koraput District,Bhanjanagar,"CE-BM,RVN Basin,Berhampur||S.E. Southern Irr. Circle I Berhampur||EE Bhanjanagar Irrigation Divn Bhanjanagar","O/o C.E.-B.M, RBVN Basin, Berhampur",Installation and energisation of Manahara IV L.I.Project under Boriguma Block of Koraput District,"9,22,000",Civil Works - Others,,761126,e-BNID-04/2022-23,2022_CEBMB_78504_8,Open Tender,Works,Nil,Nil,"783,091",26-Dec-2022,"INR 783,091",
5894,Installation and energisation of Malinibhata L.I.Project under Boriguma Block of Koraput District,Bhanjanagar,"CE-BM,RVN Basin,Berhampur||S.E. Southern Irr. Circle I Berhampur||EE Bhanjanagar Irrigation Divn Bhanjanagar","O/o C.E.-B.M, RBVN Basin, Berhampur",Installation and energisation of Malinibhata L.I.Project under Boriguma Block of Koraput District,"10,38,000",Civil Works - Others,,761126,e-BNID-04/2022-23,2022_CEBMB_78504_7,Open Tender,Works,Nil,Nil,"881,770",24-Dec-2022,"INR 881,770",
5895,Installation and energisation of Lodijodi L.I.Project under Boriguma Block of Koraput District,Bhanjanagar,"CE-BM,RVN Basin,Berhampur||S.E. Southern Irr. Circle I Berhampur||EE Bhanjanagar Irrigation Divn Bhanjanagar","O/o C.E.-B.M, RBVN Basin, Berhampur",Installation and energisation of Lodijodi L.I.Project under Boriguma Block of Koraput District,"9,47,000",Civil Works - Others,,761126,e-BNID-04/2022-23,2022_CEBMB_78504_6,Open Tender,Works,Nil,Nil,"804,935",24-Dec-2022,"INR 804,935",
5896,Installation and energisation of Keraput IV L.I.Project under Boriguma Block of Koraput District,Bhanjanagar,"CE-BM,RVN Basin,Berhampur||S.E. Southern Irr. Circle I Berhampur||EE Bhanjanagar Irrigation Divn Bhanjanagar","O/o C.E.-B.M, RBVN Basin, Berhampur",Installation and energisation of Keraput IV L.I.Project under Boriguma Block of Koraput District,"19,13,000",Civil Works - Others,,761126,e-BNID-04/2022-23,2022_CEBMB_78504_5,Open Tender,Works,Nil,Nil,"1,626,020",26-Dec-2022,"INR 1,626,020",
5897,Installation and energisation of Keraput III L.I.Project under Boriguma Block of Koraput District,Bhanjanagar,"CE-BM,RVN Basin,Berhampur||S.E. Southern Irr. Circle I Berhampur||EE Bhanjanagar Irrigation Divn Bhanjanagar","O/o C.E.-B.M, RBVN Basin, Berhampur",Installation and energisation of Keraput III L.I.Project under Boriguma Block of Koraput District,"11,59,000",Civil Works - Others,,761126,e-BNID-04/2022-23,2022_CEBMB_78504_4,Open Tender,Works,Nil,Nil,"985,160",25-Dec-2022,"INR 985,160",
5898,Installation and energisation of Kamta XIII L.I.Project under Boriguma Block of Koraput District,Bhanjanagar,"CE-BM,RVN Basin,Berhampur||S.E. Southern Irr. Circle I Berhampur||EE Bhanjanagar Irrigation Divn Bhanjanagar","O/o C.E.-B.M, RBVN Basin, Berhampur",Installation and energisation of Kamta XIII L.I.Project under Boriguma Block of Koraput District,"15,05,000",Civil Works - Others,,761126,e-BNID-04/2022-23,2022_CEBMB_78504_3,Open Tender,Works,Nil,Nil,"1,279,061",25-Dec-2022,"INR 1,279,061",
5899,Installation and energisation of Kamta XII L.I.Project under Boriguma Block of Koraput District,Bhanjanagar,"CE-BM,RVN Basin,Berhampur||S.E. Southern Irr. Circle I Berhampur||EE Bhanjanagar Irrigation Divn Bhanjanagar","O/o C.E.-B.M, RBVN Basin, Berhampur",Installation and energisation of Kamta XII L.I.Project under Boriguma Block of Koraput District,"6,36,000",Civil Works - Others,,761126,e-BNID-04/2022-23,2022_CEBMB_78504_26,Open Tender,Works,Nil,Nil,"436,766",26-Dec-2022,"INR 436,766",
5900,Installation and energisation of Ditiguda IV L.I.Project under Boriguma Block of Koraput District,Bhanjanagar,"CE-BM,RVN Basin,Berhampur||S.E. Southern Irr. Circle I Berhampur||EE Bhanjanagar Irrigation Divn Bhanjanagar","O/o C.E.-B.M, RBVN Basin, Berhampur",Installation and energisation of Ditiguda IV L.I.Project under Boriguma Block of Koraput District,"10,99,000",Civil Works - Others,,761126,e-BNID-04/2022-23,2022_CEBMB_78504_25,Open Tender,Works,Nil,Nil,"934,023",26-Dec-2022,"INR 934,023",
5901,Installation and energisation of Bharuabadi - III L.I.Project under Baipariguda Block of Koraput District,Bhanjanagar,"CE-BM,RVN Basin,Berhampur||S.E. Southern Irr. Circle I Berhampur||EE Bhanjanagar Irrigation Divn Bhanjanagar","O/o C.E.-B.M, RBVN Basin, Berhampur",Installation and energisation of Bharuabadi - III L.I.Project under Baipariguda Block of Koraput District,"9,76,000",Civil Works - Others,,761126,e-BNID-04/2022-23,2022_CEBMB_78504_24,Open Tender,Works,Nil,Nil,"829,417",26-Dec-2022,"INR 829,417",
5902,Installation and energisation of Dengapadar VIII L.I.Project under Boriguma Block of Koraput District,Bhanjanagar,"CE-BM,RVN Basin,Berhampur||S.E. Southern Irr. Circle I Berhampur||EE Bhanjanagar Irrigation Divn Bhanjanagar","O/o C.E.-B.M, RBVN Basin, Berhampur",Installation and energisation of Dengapadar VIII L.I.Project under Boriguma Block of Koraput District,"5,22,000",Civil Works - Others,,761126,e-BNID-04/2022-23,2022_CEBMB_78504_23,Open Tender,Works,Nil,Nil,"443,708",26-Dec-2022,"INR 443,708",
5903,Installation and energisation of Dengapadar IX L.I.Project under Boriguma Block of Koraput District,Bhanjanagar,"CE-BM,RVN Basin,Berhampur||S.E. Southern Irr. Circle I Berhampur||EE Bhanjanagar Irrigation Divn Bhanjanagar","O/o C.E.-B.M, RBVN Basin, Berhampur",Installation and energisation of Dengapadar IX L.I.Project under Boriguma Block of Koraput District,"7,89,000",Civil Works - Others,,761126,e-BNID-04/2022-23,2022_CEBMB_78504_22,Open Tender,Works,Nil,Nil,"670,300",26-Dec-2022,"INR 670,300",
5904,Installation and energisation of Churamula VIII L.I.Project under Boriguma Block of Koraput District,Bhanjanagar,"CE-BM,RVN Basin,Berhampur||S.E. Southern Irr. Circle I Berhampur||EE Bhanjanagar Irrigation Divn Bhanjanagar","O/o C.E.-B.M, RBVN Basin, Berhampur",Installation and energisation of Churamula VIII L.I.Project under Boriguma Block of Koraput District,"15,67,000",Civil Works - Others,,761126,e-BNID-04/2022-23,2022_CEBMB_78504_21,Open Tender,Works,Nil,Nil,"1,331,853",26-Dec-2022,"INR 1,331,853",
5905,Installation and energisation of Churamula VII L.I.Project under Boriguma Block of Koraput District,Bhanjanagar,"CE-BM,RVN Basin,Berhampur||S.E. Southern Irr. Circle I Berhampur||EE Bhanjanagar Irrigation Divn Bhanjanagar","O/o C.E.-B.M, RBVN Basin, Berhampur",Installation and energisation of Churamula VII L.I.Project under Boriguma Block of Koraput District,"10,38,000",Civil Works - Others,,761126,e-BNID-04/2022-23,2022_CEBMB_78504_20,Open Tender,Works,Nil,Nil,"882,355",24-Dec-2022,"INR 882,355",
5906,Installation and energisation of Churamula VI L.I.Project under Boriguma Block of Koraput District,Bhanjanagar,"CE-BM,RVN Basin,Berhampur||S.E. Southern Irr. Circle I Berhampur||EE Bhanjanagar Irrigation Divn Bhanjanagar","O/o C.E.-B.M, RBVN Basin, Berhampur",Installation and energisation of Churamula VI L.I.Project under Boriguma Block of Koraput District,"14,43,000",Civil Works - Others,,761126,e-BNID-04/2022-23,2022_CEBMB_78504_2,Open Tender,Works,Nil,Nil,"1,226,678",25-Dec-2022,"INR 1,226,678",
5907,Installation and energisation of Champia L.I.Project under Boriguma Block of Koraput District,Bhanjanagar,"CE-BM,RVN Basin,Berhampur||S.E. Southern Irr. Circle I Berhampur||EE Bhanjanagar Irrigation Divn Bhanjanagar","O/o C.E.-B.M, RBVN Basin, Berhampur",Installation and energisation of Champia L.I.Project under Boriguma Block of Koraput District,"15,66,000",Civil Works - Others,,761126,e-BNID-04/2022-23,2022_CEBMB_78504_19,Open Tender,Works,Nil,Nil,"1,330,859",26-Dec-2022,"INR 1,330,859",
5908,Installation and energisation of Badigam VI L.I.Project under Boriguma Block of Koraput District,Bhanjanagar,"CE-BM,RVN Basin,Berhampur||S.E. Southern Irr. Circle I Berhampur||EE Bhanjanagar Irrigation Divn Bhanjanagar","O/o C.E.-B.M, RBVN Basin, Berhampur",Installation and energisation of Badigam VI L.I.Project under Boriguma Block of Koraput District,"9,48,000",Civil Works - Others,,761126,e-BNID-04/2022-23,2022_CEBMB_78504_18,Open Tender,Works,Nil,Nil,"805,756",24-Dec-2022,"INR 805,756",
5909,Installation and energisation of B Singpur V L.I.Project under Boriguma Block of Koraput District,Bhanjanagar,"CE-BM,RVN Basin,Berhampur||S.E. Southern Irr. Circle I Berhampur||EE Bhanjanagar Irrigation Divn Bhanjanagar","O/o C.E.-B.M, RBVN Basin, Berhampur",Installation and energisation of B Singpur V L.I.Project under Boriguma Block of Koraput District,"13,89,000",Civil Works - Others,,761126,e-BNID-04/2022-23,2022_CEBMB_78504_17,Open Tender,Works,Nil,Nil,"1,180,656",26-Dec-2022,"INR 1,180,656",
5910,Installation and energisation of Sanasarapalli VIII L.I.Project under Bandhugam Block of Koraput District,Bhanjanagar,"CE-BM,RVN Basin,Berhampur||S.E. Southern Irr. Circle I Berhampur||EE Bhanjanagar Irrigation Divn Bhanjanagar","O/o C.E.-B.M, RBVN Basin, Berhampur",Installation and energisation of Sanasarapalli VIII L.I.Project under Bandhugam Block of Koraput District,"13,58,000",Civil Works - Others,,761126,e-BNID-04/2022-23,2022_CEBMB_78504_16,Open Tender,Works,Nil,Nil,"1,154,011",26-Dec-2022,"INR 1,154,011",
5911,Installation and energisation of Sanapalmunda VII L.I.Project under Bandhugam Block of Koraput District,Bhanjanagar,"CE-BM,RVN Basin,Berhampur||S.E. Southern Irr. Circle I Berhampur||EE Bhanjanagar Irrigation Divn Bhanjanagar","O/o C.E.-B.M, RBVN Basin, Berhampur",Installation and energisation of Sanapalmunda VII L.I.Project under Bandhugam Block of Koraput District,"14,13,000",Civil Works - Others,,761126,e-BNID-04/2022-23,2022_CEBMB_78504_15,Open Tender,Works,Nil,Nil,"1,200,619",26-Dec-2022,"INR 1,200,619",
5912,Installation and energisation of Baliapadar L.I.Project under Baipariguda Block of Koraput District,Bhanjanagar,"CE-BM,RVN Basin,Berhampur||S.E. Southern Irr. Circle I Berhampur||EE Bhanjanagar Irrigation Divn Bhanjanagar","O/o C.E.-B.M, RBVN Basin, Berhampur",Installation and energisation of Baliapadar L.I.Project under Baipariguda Block of Koraput District,"9,78,000",Civil Works - Others,,761126,e-BNID-04/2022-23,2022_CEBMB_78504_14,Open Tender,Works,Nil,Nil,"830,761",26-Dec-2022,"INR 830,761",
5913,Installation and energisation of Sanamathur II L.I.Project under Bandhugam Block of Koraput District,Bhanjanagar,"CE-BM,RVN Basin,Berhampur||S.E. Southern Irr. Circle I Berhampur||EE Bhanjanagar Irrigation Divn Bhanjanagar","O/o C.E.-B.M, RBVN Basin, Berhampur",Installation and energisation of Sanamathur II L.I.Project under Bandhugam Block of Koraput District,"9,77,000",Civil Works - Others,,761126,e-BNID-04/2022-23,2022_CEBMB_78504_13,Open Tender,Works,Nil,Nil,"829,801",26-Dec-2022,"INR 829,801",
5914,Installation and energisation of Putikabalsa II L.I.Project under Bandhugam Block of Koraput District,Bhanjanagar,"CE-BM,RVN Basin,Berhampur||S.E. Southern Irr. Circle I Berhampur||EE Bhanjanagar Irrigation Divn Bhanjanagar","O/o C.E.-B.M, RBVN Basin, Berhampur",Installation and energisation of Putikabalsa II L.I.Project under Bandhugam Block of Koraput District,"12,40,000",Civil Works - Others,,761126,e-BNID-04/2022-23,2022_CEBMB_78504_12,Open Tender,Works,Nil,Nil,"1,053,693",26-Dec-2022,"INR 1,053,693",
5915,Installation and energisation of Putikabalsa I L.I.Project under Bandhugam Block of Koraput District,Bhanjanagar,"CE-BM,RVN Basin,Berhampur||S.E. Southern Irr. Circle I Berhampur||EE Bhanjanagar Irrigation Divn Bhanjanagar","O/o C.E.-B.M, RBVN Basin, Berhampur",Installation and energisation of Putikabalsa I L.I.Project under Bandhugam Block of Koraput District,"18,11,000",Civil Works - Others,,761126,e-BNID-04/2022-23,2022_CEBMB_78504_11,Open Tender,Works,Nil,Nil,"1,539,513",26-Dec-2022,"INR 1,539,513",
5916,Installation and energisation of Palaka L.I.Project under Bandhugam Block of Koraput District,Bhanjanagar,"CE-BM,RVN Basin,Berhampur||S.E. Southern Irr. Circle I Berhampur||EE Bhanjanagar Irrigation Divn Bhanjanagar","O/o C.E.-B.M, RBVN Basin, Berhampur",Installation and energisation of Palaka L.I.Project under Bandhugam Block of Koraput District,"9,45,000",Civil Works - Others,,761126,e-BNID-04/2022-23,2022_CEBMB_78504_10,Open Tender,Works,Nil,Nil,"802,657",26-Dec-2022,"INR 802,657",
5917,Installation and energisation of Leding I II L.I.Project under Bandhugam Block of Koraput District,Bhanjanagar,"CE-BM,RVN Basin,Berhampur||S.E. Southern Irr. Circle I Berhampur||EE Bhanjanagar Irrigation Divn Bhanjanagar","O/o C.E.-B.M, RBVN Basin, Berhampur",Installation and energisation of Leding I II L.I.Project under Bandhugam Block of Koraput District,"11,96,000",Civil Works - Others,,761126,e-BNID-04/2022-23,2022_CEBMB_78504_1,Open Tender,Works,Nil,Nil,"1,016,441",25-Dec-2022,"INR 1,016,441",
5918,Installation and energisation of Kintalbhadra - III L.I.Project under Bandhugam Block of Koraput District,Bhanjanagar,"CE-BM,RVN Basin,Berhampur||S.E. Southern Irr. Circle I Berhampur||EE Bhanjanagar Irrigation Divn Bhanjanagar","O/o C.E.-B.M, RBVN Basin, Berhampur",Installation and energisation of Kintalbhadra - III L.I.Project under Bandhugam Block of Koraput District,"5,32,000",Civil Works - Others,,761126,e-BNID-03/2022-23,2022_CEBMB_77896_7,Open Tender,Works,Nil,Nil,"531,900",23-Dec-2022,"INR 531,900",
5919,Installation and energisation of Katragada - IV L.I.Project under Bandhugam Block of Koraput District,Bhanjanagar,"CE-BM,RVN Basin,Berhampur||S.E. Southern Irr. Circle I Berhampur||EE Bhanjanagar Irrigation Divn Bhanjanagar","O/o C.E.-B.M, RBVN Basin, Berhampur",Installation and energisation of Katragada - IV L.I.Project under Bandhugam Block of Koraput District,"6,06,000",Civil Works - Others,,761126,e-BNID-03/2022-23,2022_CEBMB_77896_6,Open Tender,Works,Nil,Nil,"605,858",23-Dec-2022,"INR 605,858",
5920,Installation and energisation of Kanagaon - III L.I.Project under Bandhugam Block of Koraput District,Bhanjanagar,"CE-BM,RVN Basin,Berhampur||S.E. Southern Irr. Circle I Berhampur||EE Bhanjanagar Irrigation Divn Bhanjanagar","O/o C.E.-B.M, RBVN Basin, Berhampur",Installation and energisation of Kanagaon - III L.I.Project under Bandhugam Block of Koraput District,"6,44,000",Civil Works - Others,,761126,e-BNID-03/2022-23,2022_CEBMB_77896_5,Open Tender,Works,Nil,Nil,"634,818",23-Dec-2022,"INR 634,818",
