Original Index,Title,Location,Organisation Chain,Bid Opening Place,Work Description,Tender Value in ₹,Product Category,Sub category,Pincode,Tender Reference Number,Tender ID,Tender Type,Tender Category,EMD Payable To,EMD Payable At,Awarded Value,Contract Date :,Contract Value :,Unnamed: 18
4547,Installation and Energisation of Purunapani III TW LIP under Khunta Block in Mayurbhanj district.,SUNDARGARH,OPEPA Bhubaneswar||Samagra Shiksha Sundargarh,DPO SS SNG,Installation and Energisation of Purunapani III TW LIP under Khunta Block in Mayurbhanj district.,"1,23,52,354",Civil Works - Buildings,,770001,DPCSNG/07/SS of 2021-22,2021_OPEPA_73500_23,Open Tender,Works,Nil,Nil,"11,118,354.57",27-Jun-2022,"INR 11,118,354.57",
4548,Installation and Energisation of Gayalmara II TW LIP under Khunta Block in Mayurbhanj district.,SUNDARGARH,OPEPA Bhubaneswar||Samagra Shiksha Sundargarh,DPO SS SNG,Installation and Energisation of Gayalmara II TW LIP under Khunta Block in Mayurbhanj district.,"1,15,05,061",Civil Works - Buildings,,770001,DPCSNG/07/SS of 2021-22,2021_OPEPA_73500_22,Open Tender,Works,Nil,Nil,"10,355,705.42",25-Apr-2022,"INR 10,355,705.42",
4549,Installation and Energisation of Gayalmara Mahalisahi TW LIP under Khunta Block in Mayurbhanj district.,SUNDARGARH,OPEPA Bhubaneswar||Samagra Shiksha Sundargarh,DPO SS SNG,Installation and Energisation of Gayalmara Mahalisahi TW LIP under Khunta Block in Mayurbhanj district.,"2,19,41,604",Civil Works - Buildings,,770001,DPCSNG/07/SS of 2021-22,2021_OPEPA_73500_21,Open Tender,Works,Nil,Nil,"19,749,638.31",25-Apr-2022,"INR 19,749,638.31",
4550,Installation and Energisation of Nunkua TW LIP under Badasahi Block in Mayurbhanj district.,SUNDARGARH,OPEPA Bhubaneswar||Samagra Shiksha Sundargarh,DPO SS SNG,Installation and Energisation of Nunkua TW LIP under Badasahi Block in Mayurbhanj district.,"1,30,34,831",Civil Works - Buildings,,770001,DPCSNG/07/SS of 2021-22,2021_OPEPA_73500_20,Open Tender,Works,Nil,Nil,"11,732,651.48",25-Apr-2022,"INR 11,732,651.48",
4551,Installation and Energisation of Simagadia V TW LIP under Khunta Block in Mayurbhanj district.,SUNDARGARH,OPEPA Bhubaneswar||Samagra Shiksha Sundargarh,DPO SS SNG,Installation and Energisation of Simagadia V TW LIP under Khunta Block in Mayurbhanj district.,"1,26,16,461",Civil Works - Buildings,,770001,DPCSNG/07/SS of 2021-22,2021_OPEPA_73500_2,Open Tender,Works,Nil,Nil,"11,356,077.43",20-Jun-2022,"INR 11,356,077.43",
4552,Installation and Energisation of Simagadia IV TW LIP under Khunta Block in Mayurbhanj district.,SUNDARGARH,OPEPA Bhubaneswar||Samagra Shiksha Sundargarh,DPO SS SNG,Installation and Energisation of Simagadia IV TW LIP under Khunta Block in Mayurbhanj district.,"91,52,060",Civil Works - Buildings,,770001,DPCSNG/07/SS of 2021-22,2021_OPEPA_73500_19,Open Tender,Works,Nil,Nil,"8,226,787.20",25-Apr-2022,"INR 8,226,787.2",
4553,Installation and Energisation of Simagadia III TW LIP under Khunta Block in Mayurbhanj district.,SUNDARGARH,OPEPA Bhubaneswar||Samagra Shiksha Sundargarh,DPO SS SNG,Installation and Energisation of Simagadia III TW LIP under Khunta Block in Mayurbhanj district.,"1,90,64,014",Civil Works - Buildings,,770001,DPCSNG/07/SS of 2021-22,2021_OPEPA_73500_18,Open Tender,Works,Nil,Nil,"17,136,642.71",25-Apr-2022,"INR 17,136,642.71",
4554,Installation and Energisation of Astapura TW LIP under Khunta Block in Mayurbhanj district.,SUNDARGARH,OPEPA Bhubaneswar||Samagra Shiksha Sundargarh,DPO SS SNG,Installation and Energisation of Astapura TW LIP under Khunta Block in Mayurbhanj district.,"4,41,67,634",Civil Works - Buildings,,770001,DPCSNG/07/SS of 2021-22,2021_OPEPA_73500_17,Open Tender,Works,Nil,Nil,"38,576,012.16",25-Apr-2022,"INR 38,576,012.16",
4555,Installation and Energisation of Ambasola TW LIP under GB Nagar Block in Mayurbhanj district.,SUNDARGARH,OPEPA Bhubaneswar||Samagra Shiksha Sundargarh,DPO SS SNG,Installation and Energisation of Ambasola TW LIP under GB Nagar Block in Mayurbhanj district.,"1,90,36,902",Civil Works - Buildings,,770001,DPCSNG/07/SS of 2021-22,2021_OPEPA_73500_16,Open Tender,Works,Nil,Nil,"17,135,115.73",27-Jun-2022,"INR 17,135,115.73",
4556,Installation and Energisation of Srinathpur Chheliabeda RL LIP under GB Nagar Block in Mayurbhanj district.,SUNDARGARH,OPEPA Bhubaneswar||Samagra Shiksha Sundargarh,DPO SS SNG,Installation and Energisation of Srinathpur Chheliabeda RL LIP under GB Nagar Block in Mayurbhanj district.,"1,11,82,739",Civil Works - Buildings,,770001,DPCSNG/07/SS of 2021-22,2021_OPEPA_73500_15,Open Tender,Works,Nil,Nil,"10,065,583.40",25-Apr-2022,"INR 10,065,583.4",
4557,Installation and Energisation of Balijoda RL LIP under GB Nagar Block in Mayurbhanj district.,SUNDARGARH,OPEPA Bhubaneswar||Samagra Shiksha Sundargarh,DPO SS SNG,Installation and Energisation of Balijoda RL LIP under GB Nagar Block in Mayurbhanj district.,"86,84,368",Civil Works - Buildings,,770001,DPCSNG/07/SS of 2021-22,2021_OPEPA_73500_14,Open Tender,Works,Nil,Nil,"7,816,800.40",27-Jun-2022,"INR 7,816,800.4",
4558,Installation and Energisation of Daripal RL LIP under GB Nagar Block in Mayurbhanj district.,SUNDARGARH,OPEPA Bhubaneswar||Samagra Shiksha Sundargarh,DPO SS SNG,Installation and Energisation of Daripal RL LIP under GB Nagar Block in Mayurbhanj district.,"74,19,590",Civil Works - Buildings,,770001,DPCSNG/07/SS of 2021-22,2021_OPEPA_73500_13,Open Tender,Works,Nil,Nil,"6,678,373.17",27-Jun-2022,"INR 6,678,373.17",
4559,Installation and Energisation of Saria II TW LIP under Betnoti Block in Mayurbhanj district.,SUNDARGARH,OPEPA Bhubaneswar||Samagra Shiksha Sundargarh,DPO SS SNG,Installation and Energisation of Saria II TW LIP under Betnoti Block in Mayurbhanj district.,"1,24,25,131",Civil Works - Buildings,,770001,DPCSNG/07/SS of 2021-22,2021_OPEPA_73500_128,Open Tender,Works,Nil,Nil,"11,183,860.75",25-Apr-2022,"INR 11,183,860.75",
4560,Installation and Energisation of Agada III and Agada IV TW LIP under Betnoti Block in Mayurbhanj district.,SUNDARGARH,OPEPA Bhubaneswar||Samagra Shiksha Sundargarh,DPO SS SNG,Installation and Energisation of Agada III and Agada IV TW LIP under Betnoti Block in Mayurbhanj district.,"85,45,206",Civil Works - Buildings,,770001,DPCSNG/07/SS of 2021-22,2021_OPEPA_73500_127,Open Tender,Works,Nil,Nil,"7,691,540.42",25-Apr-2022,"INR 7,691,540.42",
4561,Installation and Energisation of Mirigidari III TW LIP under Badasahi Block in Mayurbhanj district.,SUNDARGARH,OPEPA Bhubaneswar||Samagra Shiksha Sundargarh,DPO SS SNG,Installation and Energisation of Mirigidari III TW LIP under Badasahi Block in Mayurbhanj district.,"1,41,58,649",Civil Works - Buildings,,770001,DPCSNG/07/SS of 2021-22,2021_OPEPA_73500_126,Open Tender,Works,Nil,Nil,"12,690,397.55",25-Apr-2022,"INR 12,690,397.55",
4562,Installation and Energisation of Padmanavopur TW LIP under Betnoti Block in Mayurbhanj district.,SUNDARGARH,OPEPA Bhubaneswar||Samagra Shiksha Sundargarh,DPO SS SNG,Installation and Energisation of Padmanavopur TW LIP under Betnoti Block in Mayurbhanj district.,"1,16,21,328",Civil Works - Buildings,,770001,DPCSNG/07/SS of 2021-22,2021_OPEPA_73500_125,Open Tender,Works,Nil,Nil,"10,416,196.42",25-Apr-2022,"INR 10,416,196.42",
4563,Installation and Energisation of Santara III TW LIP under Betnoti Block in Mayurbhanj district.,SUNDARGARH,OPEPA Bhubaneswar||Samagra Shiksha Sundargarh,DPO SS SNG,Installation and Energisation of Santara III TW LIP under Betnoti Block in Mayurbhanj district.,"90,19,704",Civil Works - Buildings,,770001,DPCSNG/07/SS of 2021-22,2021_OPEPA_73500_124,Open Tender,Works,Nil,Nil,"8,084,361.25",25-Apr-2022,"INR 8,084,361.25",
4564,Installation and Energisation of Panasia II TW LIP under Betnoti Block in Mayurbhanj district.,SUNDARGARH,OPEPA Bhubaneswar||Samagra Shiksha Sundargarh,DPO SS SNG,Installation and Energisation of Panasia II TW LIP under Betnoti Block in Mayurbhanj district.,"72,01,180",Civil Works - Buildings,,770001,DPCSNG/07/SS of 2021-22,2021_OPEPA_73500_121,Open Tender,Works,Nil,Nil,"6,481,782.17",20-Jun-2022,"INR 6,481,782.17",
4565,Installation and Energisation of Benapura II TW LIP under Betnoti Block in Mayurbhanj district.,SUNDARGARH,OPEPA Bhubaneswar||Samagra Shiksha Sundargarh,DPO SS SNG,Installation and Energisation of Benapura II TW LIP under Betnoti Block in Mayurbhanj district.,"1,91,05,202",Civil Works - Buildings,,770001,DPCSNG/07/SS of 2021-22,2021_OPEPA_73500_120,Open Tender,Works,Nil,Nil,"17,196,593.11",25-Apr-2022,"INR 17,196,593.11",
4566,Installation and Energisation of Anla III TW LIP under Betnoti Block in Mayurbhanj district.,SUNDARGARH,OPEPA Bhubaneswar||Samagra Shiksha Sundargarh,DPO SS SNG,Installation and Energisation of Anla III TW LIP under Betnoti Block in Mayurbhanj district.,"1,14,81,034",Civil Works - Buildings,,770001,DPCSNG/07/SS of 2021-22,2021_OPEPA_73500_12,Open Tender,Works,Nil,Nil,"10,334,079.58",25-Apr-2022,"INR 10,334,079.58",
4567,Installation and Energisation of Tentuligaon TW LIP under Betnoti Block in Mayurbhanj district.,SUNDARGARH,OPEPA Bhubaneswar||Samagra Shiksha Sundargarh,DPO SS SNG,Installation and Energisation of Tentuligaon TW LIP under Betnoti Block in Mayurbhanj district.,"1,19,64,801",Civil Works - Buildings,,770001,DPCSNG/07/SS of 2021-22,2021_OPEPA_73500_119,Open Tender,Works,Nil,Nil,"11,367,758.21",25-Apr-2022,"INR 11,367,758.21",
4568,Installation and Energisation of Haripur Nuagaon and Krushnachandrapur TW LIP under Betnoti Block in Mayurbhanj district.,SUNDARGARH,OPEPA Bhubaneswar||Samagra Shiksha Sundargarh,DPO SS SNG,Installation and Energisation of Haripur Nuagaon and Krushnachandrapur TW LIP under Betnoti Block in Mayurbhanj district.,"1,58,44,105",Civil Works - Buildings,,770001,DPCSNG/07/SS of 2021-22,2021_OPEPA_73500_116,Open Tender,Works,Nil,Nil,"14,261,278.91",25-Apr-2022,"INR 14,261,278.91",
4569,Installation and Energisation of Haripur I TW LIP under Betnoti Block in Mayurbhanj district.,SUNDARGARH,OPEPA Bhubaneswar||Samagra Shiksha Sundargarh,DPO SS SNG,Installation and Energisation of Haripur I TW LIP under Betnoti Block in Mayurbhanj district.,"2,37,91,865",Civil Works - Buildings,,770001,DPCSNG/07/SS of 2021-22,2021_OPEPA_73500_115,Open Tender,Works,Nil,Nil,"21,415,057.92",25-Apr-2022,"INR 21,415,057.92",
4570,Installation and Energisation of Madhukhunta II RL LIP under Betnoti Block in Mayurbhanj district.,SUNDARGARH,OPEPA Bhubaneswar||Samagra Shiksha Sundargarh,DPO SS SNG,Installation and Energisation of Madhukhunta II RL LIP under Betnoti Block in Mayurbhanj district.,"1,01,38,981",Civil Works - Buildings,,770001,DPCSNG/07/SS of 2021-22,2021_OPEPA_73500_114,Open Tender,Works,Nil,Nil,"10,138,981.26",25-Apr-2022,"INR 10,138,981.26",
4571,Installation and Energisation of Bengachua TW LIP under Betnoti Block in Mayurbhanj district.,SUNDARGARH,OPEPA Bhubaneswar||Samagra Shiksha Sundargarh,DPO SS SNG,Installation and Energisation of Bengachua TW LIP under Betnoti Block in Mayurbhanj district.,"1,37,64,038",Civil Works - Buildings,,770001,DPCSNG/07/SS of 2021-22,2021_OPEPA_73500_113,Open Tender,Works,Nil,Nil,"12,389,010.74",25-Apr-2022,"INR 12,389,010.74",
4572,Installation and Energisation of Manogobindpur IV TW LIP under Badasahi Block in Mayurbhanj district.,SUNDARGARH,OPEPA Bhubaneswar||Samagra Shiksha Sundargarh,DPO SS SNG,Installation and Energisation of Manogobindpur IV TW LIP under Badasahi Block in Mayurbhanj district.,"1,34,58,593",Civil Works - Buildings,,770001,DPCSNG/07/SS of 2021-22,2021_OPEPA_73500_112,Open Tender,Works,Nil,Nil,"12,114,080.21",25-Apr-2022,"INR 12,114,080.21",
4573,Installation and Energisation of Bainchapurunia TW LIP under Betnoti Block in Mayurbhanj district.,SUNDARGARH,OPEPA Bhubaneswar||Samagra Shiksha Sundargarh,DPO SS SNG,Installation and Energisation of Bainchapurunia TW LIP under Betnoti Block in Mayurbhanj district.,"1,66,63,944",Civil Works - Buildings,,770001,DPCSNG/07/SS of 2021-22,2021_OPEPA_73500_111,Open Tender,Works,Nil,Nil,"14,999,216.46",20-Jun-2022,"INR 14,999,216.46",
4574,Installation and Energisation of Bainchamangalasahi I and Bainchamangalasahi II TW LIP under Betnoti Block in Mayurbhanj district.,SUNDARGARH,OPEPA Bhubaneswar||Samagra Shiksha Sundargarh,DPO SS SNG,Installation and Energisation of Bainchamangalasahi I and Bainchamangalasahi II TW LIP under Betnoti Block in Mayurbhanj district.,"80,39,558",Civil Works - Buildings,,770001,DPCSNG/07/SS of 2021-22,2021_OPEPA_73500_110,Open Tender,Works,Nil,Nil,"7,477,593.69",25-Apr-2022,"INR 7,477,593.69",
4575,Installation and Energisation of Purunianuagaon I and Purunianuagaon II TW LIP under Betnoti Block in Mayurbhanj district.,SUNDARGARH,OPEPA Bhubaneswar||Samagra Shiksha Sundargarh,DPO SS SNG,Installation and Energisation of Purunianuagaon I and Purunianuagaon II TW LIP under Betnoti Block in Mayurbhanj district.,"1,27,64,102",Civil Works - Buildings,,770001,DPCSNG/07/SS of 2021-22,2021_OPEPA_73500_11,Open Tender,Works,Nil,Nil,"11,488,968.79",25-Apr-2022,"INR 11,488,968.79",
4576,Installation and Energisation of Singhadiha I and Singhadiha II TW LIP under Betnoti Block in Mayurbhanj district.,SUNDARGARH,OPEPA Bhubaneswar||Samagra Shiksha Sundargarh,DPO SS SNG,Installation and Energisation of Singhadiha I and Singhadiha II TW LIP under Betnoti Block in Mayurbhanj district.,"1,65,00,088",Civil Works - Buildings,,770001,DPCSNG/07/SS of 2021-22,2021_OPEPA_73500_109,Open Tender,Works,Nil,Nil,"14,668,578.44",25-Apr-2022,"INR 14,668,578.44",
4577,Installation and Energisation of Bishnupur II TW LIP under Betnoti Block in Mayurbhanj district.,SUNDARGARH,OPEPA Bhubaneswar||Samagra Shiksha Sundargarh,DPO SS SNG,Installation and Energisation of Bishnupur II TW LIP under Betnoti Block in Mayurbhanj district.,"1,01,80,555",Civil Works - Buildings,,770001,DPCSNG/07/SS of 2021-22,2021_OPEPA_73500_108,Open Tender,Works,Nil,Nil,"9,163,518.37",25-Apr-2022,"INR 9,163,518.37",
4578,Installation and Energisation of Kainfulia and Bishnupur I TW LIP under Betnoti Block in Mayurbhanj district.,SUNDARGARH,OPEPA Bhubaneswar||Samagra Shiksha Sundargarh,DPO SS SNG,Installation and Energisation of Kainfulia and Bishnupur I TW LIP under Betnoti Block in Mayurbhanj district.,"2,20,43,445",Civil Works - Buildings,,770001,DPCSNG/07/SS of 2021-22,2021_OPEPA_73500_107,Open Tender,Works,Nil,Nil,"19,841,305.15",25-Apr-2022,"INR 19,841,305.15",
4579,Installation and Energisation of Bhagabatpur II RL LIP under Baripada Block in Mayurbhanj district.,SUNDARGARH,OPEPA Bhubaneswar||Samagra Shiksha Sundargarh,DPO SS SNG,Installation and Energisation of Bhagabatpur II RL LIP under Baripada Block in Mayurbhanj district.,"1,54,87,894",Civil Works - Buildings,,770001,DPCSNG/07/SS of 2021-22,2021_OPEPA_73500_106,Open Tender,Works,Nil,Nil,"13,940,653.51",25-Apr-2022,"INR 13,940,653.51",
4580,Installation and Energisation of Bhagabatpur I RL LIP under Baripada Block in Mayurbhanj district.,SUNDARGARH,OPEPA Bhubaneswar||Samagra Shiksha Sundargarh,DPO SS SNG,Installation and Energisation of Bhagabatpur I RL LIP under Baripada Block in Mayurbhanj district.,"1,31,36,474",Civil Works - Buildings,,770001,DPCSNG/07/SS of 2021-22,2021_OPEPA_73500_105,Open Tender,Works,Nil,Nil,"11,824,140.70",25-Apr-2022,"INR 11,824,140.7",
4581,Installation and Energisation of Damadarpur II RL LIP under Baripada Block in Mayurbhanj district.,SUNDARGARH,OPEPA Bhubaneswar||Samagra Shiksha Sundargarh,DPO SS SNG,Installation and Energisation of Damadarpur II RL LIP under Baripada Block in Mayurbhanj district.,"3,46,08,078",Civil Works - Buildings,,770001,DPCSNG/07/SS of 2021-22,2021_OPEPA_73500_103,Open Tender,Works,Nil,Nil,"31,150,731.08",25-Apr-2022,"INR 31,150,731.08",
4582,Installation and Energisation of Damadarpur I RL LIP under Baripada Block in Mayurbhanj district.,SUNDARGARH,OPEPA Bhubaneswar||Samagra Shiksha Sundargarh,DPO SS SNG,Installation and Energisation of Damadarpur I RL LIP under Baripada Block in Mayurbhanj district.,"2,45,77,216",Civil Works - Buildings,,770001,DPCSNG/07/SS of 2021-22,2021_OPEPA_73500_102,Open Tender,Works,Nil,Nil,"22,119,494.87",25-Apr-2022,"INR 22,119,494.87",
4583,Installation and Energisation of Jadida IV and Jadida V TW LIP under Badasahi Block in Mayurbhanj district.,SUNDARGARH,OPEPA Bhubaneswar||Samagra Shiksha Sundargarh,DPO SS SNG,Installation and Energisation of Jadida IV and Jadida V TW LIP under Badasahi Block in Mayurbhanj district.,"1,75,62,612",Civil Works - Buildings,,770001,DPCSNG/07/SS of 2021-22,2021_OPEPA_73500_101,Open Tender,Works,Nil,Nil,"15,808,107.45",25-Apr-2022,"INR 15,808,107.45",
4584,Installation and Energisation of Patharchakadi II TW LIP under Baripada Block in Mayurbhanj district.,SUNDARGARH,OPEPA Bhubaneswar||Samagra Shiksha Sundargarh,DPO SS SNG,Installation and Energisation of Patharchakadi II TW LIP under Baripada Block in Mayurbhanj district.,"2,67,64,897",Civil Works - Buildings,,770001,DPCSNG/07/SS of 2021-22,2021_OPEPA_73500_100,Open Tender,Works,Nil,Nil,"24,091,084.41",25-Apr-2022,"INR 24,091,084.41",
4585,Installation and Energisation of Badabrahmanamara II TW LIP under Baripada Block in Mayurbhanj district.,SUNDARGARH,OPEPA Bhubaneswar||Samagra Shiksha Sundargarh,DPO SS SNG,Installation and Energisation of Badabrahmanamara II TW LIP under Baripada Block in Mayurbhanj district.,"2,25,17,185",Civil Works - Buildings,,770001,DPCSNG/07/SS of 2021-22,2021_OPEPA_73500_10,Open Tender,Works,Nil,Nil,"20,267,718.67",25-Apr-2022,"INR 20,267,718.67",
4586,Installation and Energisation of Kailashchandrapur II RL LIP under Baripada Block in Mayurbhanj district.,SUNDARGARH,OPEPA Bhubaneswar||Samagra Shiksha Sundargarh,DPO SS SNG,Installation and Energisation of Kailashchandrapur II RL LIP under Baripada Block in Mayurbhanj district.,"2,23,52,046",Civil Works - Buildings,,770001,DPCSNG/07/SS of 2021-22,2021_OPEPA_73500_1,Open Tender,Works,Nil,Nil,"20,119,076.61",25-Apr-2022,"INR 20,119,076.61",
4587,Installation and Energisation of Bautisole TW LIP under Baripada Block in Mayurbhanj district.,SUNDARGARH,OPEPA Bhubaneswar||Samagra Shiksha Sundargarh,DPO SS SNG,Installation and Energisation of Bautisole TW LIP under Baripada Block in Mayurbhanj district.,"2,32,95,887",Civil Works - Buildings,,770001,BID IDENTIFICATION NO DPC/SS/SNG/06 OF 2021-22,2021_OPEPA_71637_49,Open Tender,Works,Nil,Nil,"20,968,628",20-Jun-2022,"INR 20,968,628",
4588,Installation and Energisation of Kumbhardubi TW LIP under Baripada Block in Mayurbhanj district.,SUNDARGARH,OPEPA Bhubaneswar||Samagra Shiksha Sundargarh,DPO SS SNG,Installation and Energisation of Kumbhardubi TW LIP under Baripada Block in Mayurbhanj district.,"78,42,302",Civil Works - Buildings,,770001,BID IDENTIFICATION NO DPC/SS/SNG/06 OF 2021-22,2021_OPEPA_71637_34,Open Tender,Works,Nil,Nil,"7,042,388",25-Apr-2022,"INR 7,042,388",
4589,Installation and Energisation of Bautia II RL LIP under Bangriposi Block in Mayurbhanj district.,SUNDARGARH,OPEPA Bhubaneswar||Samagra Shiksha Sundargarh,DPO SS SNG,Installation and Energisation of Bautia II RL LIP under Bangriposi Block in Mayurbhanj district.,"1,02,54,019",Civil Works - Buildings,,770001,BID IDENTIFICATION NO DPC/SS/SNG/06 OF 2021-22,2021_OPEPA_71637_15,Open Tender,Works,Nil,Nil,"9,216,313.07",25-Apr-2022,"INR 9,216,313.07",
4590,Installation and Energisation of Sundhisahi Nischinta II RL LIP under Bangriposi Block in Mayurbhanj district.,SUNDARGARH,OPEPA Bhubaneswar||Samagra Shiksha Sundargarh,DPO SS SNG,Installation and Energisation of Sundhisahi Nischinta II RL LIP under Bangriposi Block in Mayurbhanj district.,"1,22,95,455",Civil Works - Buildings,,770001,BID IDENTIFICATION NO DPC/SS/SNG/06 OF 2021-22,2021_OPEPA_71637_142,Open Tender,Works,Nil,Nil,"11,064,680.49",20-Jun-2022,"INR 11,064,680.49",
4591,Installation and Energisation of Nischinta IV RL LIP under Bangriposi Block in Mayurbhanj district.,SUNDARGARH,OPEPA Bhubaneswar||Samagra Shiksha Sundargarh,DPO SS SNG,Installation and Energisation of Nischinta IV RL LIP under Bangriposi Block in Mayurbhanj district.,"1,43,26,508",Civil Works - Buildings,,770001,BID IDENTIFICATION NO DPC/SS/SNG/06 OF 2021-22,2021_OPEPA_71637_12,Open Tender,Works,Nil,Nil,"12,863,772.40",25-Apr-2022,"INR 12,863,772.4",
4592,Installation and Energisation of Malihati I TW LIP under Badasahi Block in Mayurbhanj district.,SUNDARGARH,OPEPA Bhubaneswar||Samagra Shiksha Sundargarh,DPO SS SNG,Installation and Energisation of Malihati I TW LIP under Badasahi Block in Mayurbhanj district.,"88,82,161",Civil Works - Buildings,,770001,BID IDENTIFICATION NO DPC/SS/SNG/06 OF 2021-22,2021_OPEPA_71637_114,Open Tender,Works,Nil,Nil,"7,978,845.94",20-Jun-2022,"INR 7,978,845.94",
4593,Installation and Energisation of Baliadhipa RL LIP under Bangriposi Block in Mayurbhanj district.,SUNDARGARH,OPEPA Bhubaneswar||Samagra Shiksha Sundargarh,DPO SS SNG,Installation and Energisation of Baliadhipa RL LIP under Bangriposi Block in Mayurbhanj district.,"1,03,73,586",Civil Works - Buildings,,770001,BID IDENTIFICATION NO DPC/SS/SNG/06 OF 2021-22,2021_OPEPA_71637_110,Open Tender,Works,Nil,Nil,"9,315,480.54",25-Apr-2022,"INR 9,315,480.54",
4792,Installation and Energisation of Rengalbeda RL LIP under Bangriposi Block in Mayurbhanj district.,"BALIA,BALASORE,ODISHA",Orissa Lift Irrigation Corporation||LI BALASORE||LI Division Balasore,O/O E.E.L.I. DIVISION BALASORE,Installation and Energisation of Rengalbeda RL LIP under Bangriposi Block in Mayurbhanj district.,"19,78,692",Civil Works - Lift Irrigation Schemes,,756056,06/21-22 dt 18.12.2021,2021_OLIC_74613_137,Open Tender,Works,Nil,Nil,"2,140,786",18-Nov-2022,"INR 2,140,786",
4793,Installation and Energisation of Brahmangaon Papaldhar RL LIP under Bangriposi Block in Mayurbhanj district.,"BALIA,BALASORE,ODISHA",Orissa Lift Irrigation Corporation||LI BALASORE||LI Division Balasore,O/O E.E.L.I. DIVISION BALASORE,Installation and Energisation of Brahmangaon Papaldhar RL LIP under Bangriposi Block in Mayurbhanj district.,"20,06,608",Civil Works - Lift Irrigation Schemes,,756056,06/21-22 dt 18.12.2021,2021_OLIC_74613_136,Open Tender,Works,Nil,Nil,"2,175,484",18-Nov-2022,"INR 2,175,484",
4796,Installation and Energisation of Majhigaon Laldahar RL LIP under Bangriposi Block in Mayurbhanj district.,"BALIA,BALASORE,ODISHA",Orissa Lift Irrigation Corporation||LI BALASORE||LI Division Balasore,O/O E.E.L.I. DIVISION BALASORE,Installation and Energisation of Majhigaon Laldahar RL LIP under Bangriposi Block in Mayurbhanj district.,"20,08,448",Civil Works - Lift Irrigation Schemes,,756056,06/21-22 dt 18.12.2021,2021_OLIC_74613_133,Open Tender,Works,Nil,Nil,"2,024,290",18-Nov-2022,"INR 2,024,290",
4797,Installation and Energisation of Mohanpur RL LIP under Bangriposi Block in Mayurbhanj district.,"BALIA,BALASORE,ODISHA",Orissa Lift Irrigation Corporation||LI BALASORE||LI Division Balasore,O/O E.E.L.I. DIVISION BALASORE,Installation and Energisation of Mohanpur RL LIP under Bangriposi Block in Mayurbhanj district.,"21,09,651",Civil Works - Lift Irrigation Schemes,,756056,06/21-22 dt 18.12.2021,2021_OLIC_74613_132,Open Tender,Works,Nil,Nil,"2,124,166",18-Nov-2022,"INR 2,124,166",
4881,Installation and Energisation of Majhigaon Bidaghati RL LIP under Bangriposi Block in Mayurbhanj district.,JAJPUR,ODISHA CONSTRUCTION CORPORATION LTD||CIVIL,HEAD OFFICE OCCL,Installation and Energisation of Majhigaon Bidaghati RL LIP under Bangriposi Block in Mayurbhanj district.,"2,47,55,913",Civil Works - Others,,755001,e-procurement Notice No25/OCCL/2020-21 (on-line),2021_OCCL_65230_1,Open Tender,Works,Nil,Nil,"21,045,002",25-Aug-2022,"INR 24,755,913.1",
4899,Installation and Energisation of Gohirapal III RL LIP under Bangriposi Block in Mayurbhanj district.,Cuttack,EIC-CIVIL||SERNB-CIRCLE-CUTTACK||EERNB-DIVN-CUTTACK,"O/O SE Cuttack RandB Division No.I, Cuttack",Installation and Energisation of Gohirapal III RL LIP under Bangriposi Block in Mayurbhanj district.,"21,61,860",Civil Works - Roads,,753001,SE CTC (RandB)-14 of 2021-22,2021_EICCL_74835_1,National Competitive Bid,Works,Nil,Nil,"1,837,797",08-Jun-2022,"INR 1,837,797",
4910,Installation and Energisation of Bholagadia III RL LIP under Bangriposi Block in Mayurbhanj district.,"Ranihat, Cuttack",EIC-CIVIL||SE R and B Electrical,"O/o the S.E. Electrical Circle (RandB)Odisha,BBSR",Installation and Energisation of Bholagadia III RL LIP under Bangriposi Block in Mayurbhanj district.,"71,29,338",Electrical Works,,753001,Bid Identification No.S.E.E.C (RandB) 12/2021-22,2021_EICCL_74573_1,National Competitive Bid,Works,Nil,Nil,"6,060,650",06-Sep-2022,"INR 6,060,650",
4911,Installation and Energisation of Kusumbandha II RL LIP under Bangriposi Block in Mayurbhanj district.,"Rnihat, Cuttack",EIC-CIVIL||SE R and B Electrical,"O/o the S.E. Electrical (RandB) Odisha,Bhubaneswar",Installation and Energisation of Kusumbandha II RL LIP under Bangriposi Block in Mayurbhanj district.,"73,43,653",Electrical Works,,753001,Bid Identification No.S.E.E.C (RandB) 12/2021-22,2021_EICCL_74570_1,National Competitive Bid,Works,Nil,Nil,"6,242,839",31-Oct-2022,"INR 6,242,839",
4951,Installation and Energisation of NIzakainsari II RL LIP under Udala Block in Mayurbhanj district.,Laxmipur,EIC-CIVIL||SERNB-CIRCLE-JEYPORE||EERNB-DIVN-KORAPUT,"Office of the S.E R and B Division, Koraput",Installation and Energisation of NIzakainsari II RL LIP under Udala Block in Mayurbhanj district.,"31,00,000",Civil Works - Roads,Roads,765013,S.E (R and B) KPT - 06 / 2021-22,2021_EICCL_73277_2,Open Tender,Works,Nil,Nil,"2,630,122",01-Jan-2022,"INR 2,630,122",
4988,Installation and Energisation of NIzakainsari I RL LIP under Udala Block in Mayurbhanj district.,Puri,EIC-CIVIL||SERNB-CIRCLE-KHURDA||EERNB-DIVN-PURI,"O/o the S.E. R and B Division, Puri",Installation and Energisation of NIzakainsari I RL LIP under Udala Block in Mayurbhanj district.,"29,18,442",Civil Works - Others,,752001,TCN NO 29 OF 2021-22,2021_EICCL_72716_1,National Competitive Bid,Works,Nil,Nil,"2,480,968",27-Jun-2022,"INR 2,480,968",
